{
  "document_id": "01a01af6-3bbb-73b6-b78c-a91ffbd42687",
  "document_ref": "urn:uuid:01a01af6-3bbb-73b6-b78c-a91ffbd42687",
  "document_key": "package-families",
  "document_type": "package_family_catalog",
  "document_revision": 3,
  "schema_ref": "urn:uuid:01a01af6-9805-79c4-bf93-527cd90ba66d",
  "title": "ResultSafe package family boundaries",
  "summary": "Independent ownership and lifecycle boundaries for contracts, runtimes, storage projections, compilers, and integration adapters.",
  "lifecycle": "DRAFT",
  "created_at": "2026-08-19T00:00:00Z",
  "updated_at": "2026-08-20T18:00:00Z",
  "payload": {
    "items": [
      { "record_id": "01a01af6-78a4-771e-bd2e-3596c7daf06a", "record_ref": "urn:uuid:01a01af6-78a4-771e-bd2e-3596c7daf06a", "record_key": "resultsafe-core-contracts", "record_revision": 0, "kind": "package_family", "code": "RS-PKG-001", "title": "ResultSafe Core contracts", "status": "DRAFT", "package_family_key": "resultsafe-core-contracts", "role": "CONTRACTS", "lifecycle": "PROPOSED", "identity_authority": "RESULTSAFE-CONTRACT-AUTHORITY", "depends_on_family_refs": [] },
      { "record_id": "01a01af6-78a5-7cf3-a7bf-c8faedf5f8c0", "record_ref": "urn:uuid:01a01af6-78a5-7cf3-a7bf-c8faedf5f8c0", "record_key": "resultsafe-runtime-typescript", "record_revision": 0, "kind": "package_family", "code": "RS-PKG-002", "title": "ResultSafe TypeScript runtime", "status": "DRAFT", "package_family_key": "resultsafe-runtime-typescript", "role": "LANGUAGE_RUNTIME", "lifecycle": "PROPOSED", "identity_authority": "RESULTSAFE-PACKAGE-AUTHORITY", "depends_on_family_refs": ["urn:uuid:01a01af6-78a4-771e-bd2e-3596c7daf06a"] },
      { "record_id": "01a01af6-78a6-7b78-a0ee-eb7dc9e1da2f", "record_ref": "urn:uuid:01a01af6-78a6-7b78-a0ee-eb7dc9e1da2f", "record_key": "resultsafe-runtime-python", "record_revision": 1, "kind": "package_family", "code": "RS-PKG-003", "title": "ResultSafe Python runtime", "status": "IMPLEMENTED", "package_family_key": "resultsafe-runtime-python", "role": "LANGUAGE_RUNTIME", "lifecycle": "STAGED", "identity_authority": "RESULTSAFE-PACKAGE-AUTHORITY", "depends_on_family_refs": ["urn:uuid:01a01af6-78a4-771e-bd2e-3596c7daf06a"] },
      { "record_id": "01a01af6-78a7-7d36-af8d-8e0940671e00", "record_ref": "urn:uuid:01a01af6-78a7-7d36-af8d-8e0940671e00", "record_key": "resultsafe-projection-relational", "record_revision": 1, "kind": "package_family", "code": "RS-PKG-004", "title": "ResultSafe relational projection", "status": "IMPLEMENTED", "package_family_key": "resultsafe-projection-relational", "role": "STORAGE_PROJECTION", "lifecycle": "STAGED", "identity_authority": "RESULTSAFE-PROJECTION-AUTHORITY", "depends_on_family_refs": ["urn:uuid:01a01af6-78a4-771e-bd2e-3596c7daf06a"] },
      { "record_id": "01a01af6-78a8-7402-a139-9aa57b66850c", "record_ref": "urn:uuid:01a01af6-78a8-7402-a139-9aa57b66850c", "record_key": "resultsafe-projection-sqlite", "record_revision": 1, "kind": "package_family", "code": "RS-PKG-005", "title": "ResultSafe SQLite profile", "status": "IMPLEMENTED", "package_family_key": "resultsafe-projection-sqlite", "role": "STORAGE_PROJECTION", "lifecycle": "STAGED", "identity_authority": "RESULTSAFE-PROJECTION-AUTHORITY", "depends_on_family_refs": ["urn:uuid:01a01af6-78a7-7d36-af8d-8e0940671e00"] },
      { "record_id": "01a01af6-78a9-7130-8354-bc8a01495f55", "record_ref": "urn:uuid:01a01af6-78a9-7130-8354-bc8a01495f55", "record_key": "resultsafe-projection-compiler-typescript", "record_revision": 1, "kind": "package_family", "code": "RS-PKG-006", "title": "ResultSafe TypeScript projection compiler", "status": "IMPLEMENTED", "package_family_key": "resultsafe-projection-compiler-typescript", "role": "PROJECTION_COMPILER", "lifecycle": "STAGED", "identity_authority": "RESULTSAFE-TOOLING-AUTHORITY", "depends_on_family_refs": ["urn:uuid:01a01af6-78a4-771e-bd2e-3596c7daf06a", "urn:uuid:01a01af6-78a8-7402-a139-9aa57b66850c"] },
      { "record_id": "01a01af6-78aa-7d6c-a5a7-77454c7870e3", "record_ref": "urn:uuid:01a01af6-78aa-7d6c-a5a7-77454c7870e3", "record_key": "resultsafe-adapter-aasdvgs", "record_revision": 0, "kind": "package_family", "code": "RS-PKG-007", "title": "ResultSafe AASDVGS adapter", "status": "PLANNED", "package_family_key": "resultsafe-adapter-aasdvgs", "role": "INTEGRATION_ADAPTER", "lifecycle": "PROPOSED", "identity_authority": "RESULTSAFE-INTEGRATION-AUTHORITY-EXTERNAL-ADMISSION-REQUIRED", "depends_on_family_refs": ["urn:uuid:01a01af6-78a4-771e-bd2e-3596c7daf06a"] },
      { "record_id": "01a01f50-0040-7000-8000-000000000040", "record_ref": "urn:uuid:01a01f50-0040-7000-8000-000000000040", "record_key": "resultsafe-core-fp-codec-json", "record_revision": 0, "kind": "package_family", "code": "RS-PKG-008", "title": "ResultSafe explicit JSON codecs", "status": "IMPLEMENTED", "package_family_key": "resultsafe-core-fp-codec-json", "role": "INTEGRATION_ADAPTER", "lifecycle": "STAGED", "identity_authority": "RESULTSAFE-INTEGRATION-AUTHORITY", "depends_on_family_refs": ["urn:uuid:01a01af6-78a5-7cf3-a7bf-c8faedf5f8c0"] },
      { "record_id": "01a01f50-0041-7000-8000-000000000041", "record_ref": "urn:uuid:01a01f50-0041-7000-8000-000000000041", "record_key": "resultsafe-adapter-core-fp-effect", "record_revision": 0, "kind": "package_family", "code": "RS-PKG-009", "title": "ResultSafe Effect adapter", "status": "IMPLEMENTED", "package_family_key": "resultsafe-adapter-core-fp-effect", "role": "INTEGRATION_ADAPTER", "lifecycle": "STAGED", "identity_authority": "RESULTSAFE-INTEGRATION-AUTHORITY", "depends_on_family_refs": ["urn:uuid:01a01af6-78a5-7cf3-a7bf-c8faedf5f8c0"] }
    ]
  }
}
