{
  "document_id": "01a01af6-3bae-71ed-801b-4bd818c629dc",
  "document_ref": "urn:uuid:01a01af6-3bae-71ed-801b-4bd818c629dc",
  "document_key": "ai-entrypoint",
  "document_type": "entrypoint",
  "document_revision": 6,
  "schema_ref": "urn:uuid:01a01b11-f17f-7ed0-be65-212275e8e7cc",
  "title": "ResultSafe Core staging entrypoint",
  "summary": "Authoritative read order and interpretation rules for the ResultSafe Core v001 staging corpus.",
  "lifecycle": "DRAFT",
  "created_at": "2026-08-19T00:00:00Z",
  "updated_at": "2026-08-20T18:00:00Z",
  "payload": {
    "read_order": [
      "urn:uuid:01a01af6-3bad-74da-86b7-f6dfc9462b0e",
      "urn:uuid:01a01af6-3baf-7e93-b8ac-3e6dfb97bed7",
      "urn:uuid:01a01af6-3bb2-7b43-895a-2ba8ce0a4445",
      "urn:uuid:01a01af6-3bb3-70c9-87cc-da17cb6c9207",
      "urn:uuid:01a01d13-0738-7b88-beee-14e33b781ada",
      "urn:uuid:01a01d13-0738-76c5-83ab-907b36ad856e",
      "urn:uuid:01a01af6-3bb1-7002-8958-73436a16f14f",
      "urn:uuid:01a01af6-3bbd-7ddc-8e39-f49b82d35626",
      "urn:uuid:01a01af6-3bbc-74ee-afde-135b2665411e",
      "urn:uuid:01a01d00-0002-7000-8000-000000000002",
      "urn:uuid:01a01f0a-da00-7b10-9266-a2689c0f75a7",
      "urn:uuid:01a01f0a-da01-72ee-9c1b-8d0ba8c40bc4",
      "urn:uuid:01a01f0a-da02-77d4-982f-7251ea78e989",
      "urn:uuid:01a01f0a-da03-7cbe-94a8-23bc96826838",
      "urn:uuid:01a01f50-0001-7000-8000-000000000001",
      "urn:uuid:01a01f0b-0001-7000-8000-000000000001",
      "urn:uuid:01a01d86-7c23-71f6-96f1-14a59676157d",
      "urn:uuid:01a01d86-7c25-7c79-9b5c-f4ca873b3ac1",
      "urn:uuid:01a01d86-7c27-774b-a192-884970b99ad2"
    ],
    "interpretation_rules": [
      "Normative requirements override summaries and implementation behavior",
      "Canonical JSON records override generated documentation and database projections",
      "UUIDv7 identifies an entity but does not establish trusted chronology or ordering",
      "A public handle, package locator, or identifier is never an authorization capability",
      "NOT_EXECUTED and DEFERRED are never equivalent to PASS",
      "Contract IR owns canonical operation semantics and required callable surfaces",
      "FAILURE-MODEL.json owns the optional structured Failure payload while Contract IR retains unconstrained Result error E",
      "The projection catalog owns exact language spellings and support aliases derived from Contract IR",
      "Runtime code, generated documentation, and prose are conformance evidence and do not own semantics or language spellings",
      "A language projection may PASS only when every applicable neutral operation-surface cell in CONFORMANCE-MATRIX.json has exact packed-artifact evidence for the current Contract IR and projection revisions",
      "The TypeScript extension scenarios are TypeScript evidence and must never be represented as cross-language proof",
      "AASDVGS admission requires separate governed authority and is not implied by this corpus",
      "CAUSE-MODEL.json owns optional binary Cause semantics without changing generic Result.",
      "EXIT-MODEL.json owns optional Exit semantics and permits Failure with Empty Cause.",
      "EFFECT-COMPATIBILITY.json describes semantic mappings only and never representation identity.",
      "CORE-MODULARITY-POLICY.json governs the dependency-free root-plus-subpath package boundary.",
      "PUBLIC-MODULE-REGISTRY.json owns the intended public module inventory; package manifests and packed artifacts are conformance evidence.",
      "OPTIONAL-INTEGRATIONS.json owns exact optional package paths, peer dependency policy, supported external versions, vectors, and implementation evidence status.",
      "Effect executable mapping authority belongs to @resultsafe/adapter-core-fp-effect, not the core-only Cause and Exit scenarios.",
      "Effect 3.22.1 and Cause/Exit claims are QUALIFIED_LOCAL_SNAPSHOT by PASS_LOCAL_ATOMIC evidence; release approval, promotion, publication, security, and long-running claims remain excluded."
    ],
    "semantic_authority_ref": "urn:uuid:01a01af6-3bb1-7002-8958-73436a16f14f",
    "spelling_authority_ref": "urn:uuid:01a01af6-3bbc-74ee-afde-135b2665411e",
    "canonical_authority": "platform/staging/resultsafe-core-v001",
    "staging_warning": "This corpus is mutable staging evidence and is not an immutable canonical release until approved and promoted."
  }
}
